priority_rank,canonical_condition,canonical_condition_id,variant_id,question_id,question_text,contexts,source,reuse_bank_count,current_selection_level,current_urgency,default_selected,required,red_flag,clinical_rationale,follow_up_behavior,current_branching,feedback_action,proposed_text,proposed_selection_level,proposed_urgency,proposed_branching,reviewer,reviewed_at,rationale,disposition,accepted_by,accepted_at,feedback_id,row_type,bank_id,current_bank_version,current_question_version
38,Sickle Cell Disease,sickle_cell_disease,,ccm.hematology.lab_followup,"Is a blood-count test, infusion, or hematology visit overdue?",intake; monthly_checkin; care_plan_review,new,3,recommended,,true,false,false,Identifies overdue monitoring or treatment coordination.,Review a yes response during routine CCM follow-up.,"{""displayWhen"":[],""followUpTriggers"":[]}",,,,,,,,,pending,,,question:sickle_cell_disease:base:ccm.hematology.lab_followup,question,ccm-bank.sickle_cell_disease,1,1
38,Sickle Cell Disease,sickle_cell_disease,,ccm.specialist.pending_followup,"Is any specialist recommendation, test, or follow-up still incomplete?",intake; monthly_checkin; care_plan_review; annual_review,existing,47,recommended,routine,true,false,false,Reuses an established CCM question whose wording and intent fit this condition bank.,Apply the established reusable-question branching and follow-up rules.,"{""displayWhen"":[],""followUpTriggers"":[{""id"":""ccm.specialist.pending_followup-task"",""when"":{""operator"":""equals"",""value"":true},""actions"":[{""type"":""create_care_coordination_task"",""code"":""ccm_specialist_pending_followup"",""urgency"":""routine""}]}]}",,,,,,,,,pending,,,question:sickle_cell_disease:base:ccm.specialist.pending_followup,question,ccm-bank.sickle_cell_disease,1,1
38,Sickle Cell Disease,sickle_cell_disease,,ccm.hospital.had_admission,Have you been admitted to a hospital since the last review?,intake; monthly_checkin; care_plan_review; annual_review,existing,10,recommended,,true,false,false,Reuses an established CCM question whose wording and intent fit this condition bank.,Apply the established reusable-question branching and follow-up rules.,"{""displayWhen"":[],""followUpTriggers"":[{""id"":""hospital-flow"",""when"":{""operator"":""equals"",""value"":true},""actions"":[{""type"":""show_questions"",""questionIds"":[""ccm.hospital.discharge_date"",""ccm.hospital.reason"",""ccm.hospital.followup_complete""]}]}]}",,,,,,,,,pending,,,question:sickle_cell_disease:base:ccm.hospital.had_admission,question,ccm-bank.sickle_cell_disease,1,1
38,Sickle Cell Disease,sickle_cell_disease,,ccm.goal.priority,What health or daily-life goal matters most to you now?,intake; care_plan_review; annual_review,existing,79,optional,,false,false,false,Reuses an established CCM question whose wording and intent fit this condition bank.,Apply the established reusable-question branching and follow-up rules.,"{""displayWhen"":[],""followUpTriggers"":[]}",,,,,,,,,pending,,,question:sickle_cell_disease:base:ccm.goal.priority,question,ccm-bank.sickle_cell_disease,1,1
38,Sickle Cell Disease,sickle_cell_disease,crisis,ccm.sickle.pain_crisis,Have you had a sickle-cell pain crisis since the last review?,intake; monthly_checkin; care_plan_review,new,1,recommended,,true,false,false,Tracks a major disease-specific acute event.,Review a yes response during routine CCM follow-up.,"{""displayWhen"":[],""followUpTriggers"":[]}",,,,,,,,,pending,,,question:sickle_cell_disease:crisis:ccm.sickle.pain_crisis,question,ccm-bank.sickle_cell_disease,1,1
38,Sickle Cell Disease,sickle_cell_disease,acute_chest,ccm.sickle.chest_symptoms,Have you had new chest pain or new breathing difficulty?,intake; monthly_checkin; care_plan_review,new,1,required,urgent,true,true,true,Screens for possible acute chest syndrome or another urgent cardiopulmonary problem.,A yes response creates a urgent clinical-review flag.,"{""displayWhen"":[],""followUpTriggers"":[{""id"":""ccm-sickle-chest_symptoms-yes"",""when"":{""operator"":""equals"",""value"":true},""actions"":[{""type"":""flag_for_review"",""code"":""possible_acute_chest_syndrome"",""urgency"":""urgent"",""providerNotification"":true}]}]}",,,,,,,,,pending,,,question:sickle_cell_disease:acute_chest:ccm.sickle.chest_symptoms,question,ccm-bank.sickle_cell_disease,1,1
39,Non-Pressure Chronic Ulcer,non_pressure_chronic_ulcer,,ccm.general.health_change,Has your health changed since the last review?,intake; monthly_checkin; care_plan_review; annual_review,existing,81,required,soon,true,true,false,Reuses an established CCM question whose wording and intent fit this condition bank.,Apply the established reusable-question branching and follow-up rules.,"{""displayWhen"":[],""followUpTriggers"":[{""id"":""general-health-worse"",""when"":{""operator"":""equals"",""value"":""worse""},""actions"":[{""type"":""flag_for_review"",""code"":""health_worsening"",""urgency"":""soon"",""providerNotification"":false}]}]}",,,,,,,,,pending,,,question:non_pressure_chronic_ulcer:base:ccm.general.health_change,question,ccm-bank.non_pressure_chronic_ulcer,1,1
39,Non-Pressure Chronic Ulcer,non_pressure_chronic_ulcer,,ccm.medication.has_issue,Are you having any problem taking or obtaining your medications?,intake; monthly_checkin; care_plan_review; annual_review,existing,78,recommended,,true,false,false,Reuses an established CCM question whose wording and intent fit this condition bank.,Apply the established reusable-question branching and follow-up rules.,"{""displayWhen"":[],""followUpTriggers"":[{""id"":""medication-issue-details"",""when"":{""operator"":""equals"",""value"":true},""actions"":[{""type"":""show_questions"",""questionIds"":[""ccm.medication.issue_reasons"",""ccm.medication.provider_aware""]}]}]}",,,,,,,,,pending,,,question:non_pressure_chronic_ulcer:base:ccm.medication.has_issue,question,ccm-bank.non_pressure_chronic_ulcer,1,1
39,Non-Pressure Chronic Ulcer,non_pressure_chronic_ulcer,,ccm.function.daily_activity_difficulty,Are health problems making daily activities harder?,intake; monthly_checkin; care_plan_review; annual_review,existing,72,recommended,soon,true,false,false,Reuses an established CCM question whose wording and intent fit this condition bank.,Apply the established reusable-question branching and follow-up rules.,"{""displayWhen"":[],""followUpTriggers"":[{""id"":""function-review"",""when"":{""operator"":""equals"",""value"":true},""actions"":[{""type"":""flag_for_review"",""code"":""functional_decline"",""urgency"":""soon"",""providerNotification"":false}]}]}",,,,,,,,,pending,,,question:non_pressure_chronic_ulcer:base:ccm.function.daily_activity_difficulty,question,ccm-bank.non_pressure_chronic_ulcer,1,1
39,Non-Pressure Chronic Ulcer,non_pressure_chronic_ulcer,,ccm.treatment.plan_barrier,Is anything making it difficult to follow the care plan for this condition?,intake; monthly_checkin; care_plan_review,new,52,recommended,routine,true,false,false,"Identifies adherence, access, understanding, and feasibility barriers without assuming a specific treatment.",A yes response creates a routine coordinator task to identify and address the barrier.,"{""displayWhen"":[],""followUpTriggers"":[{""id"":""ccm-treatment-plan_barrier-task"",""when"":{""operator"":""equals"",""value"":true},""actions"":[{""type"":""create_care_coordination_task"",""code"":""condition_care_plan_barrier"",""urgency"":""routine""}]}]}",,,,,,,,,pending,,,question:non_pressure_chronic_ulcer:base:ccm.treatment.plan_barrier,question,ccm-bank.non_pressure_chronic_ulcer,1,1
39,Non-Pressure Chronic Ulcer,non_pressure_chronic_ulcer,,ccm.specialist.visit_change,Has a specialist changed this condition's treatment plan since the last contact?,intake; monthly_checkin; care_plan_review,new,37,recommended,routine,true,false,false,Captures treatment changes that may require medication reconciliation or care-plan updates.,A yes response creates a routine coordinator task to reconcile the updated specialist plan.,"{""displayWhen"":[],""followUpTriggers"":[{""id"":""ccm-specialist-visit_change-task"",""when"":{""operator"":""equals"",""value"":true},""actions"":[{""type"":""create_care_coordination_task"",""code"":""specialist_plan_reconciliation"",""urgency"":""routine""}]}]}",,,,,,,,,pending,,,question:non_pressure_chronic_ulcer:base:ccm.specialist.visit_change,question,ccm-bank.non_pressure_chronic_ulcer,1,1
39,Non-Pressure Chronic Ulcer,non_pressure_chronic_ulcer,,ccm.wound.size_depth_change,Has the wound become larger or deeper since the last review?,intake; monthly_checkin; care_plan_review,new,2,recommended,,true,false,false,Tracks wound progression using observable change.,Review a yes response during routine CCM follow-up.,"{""displayWhen"":[],""followUpTriggers"":[]}",,,,,,,,,pending,,,question:non_pressure_chronic_ulcer:base:ccm.wound.size_depth_change,question,ccm-bank.non_pressure_chronic_ulcer,1,1
39,Non-Pressure Chronic Ulcer,non_pressure_chronic_ulcer,,ccm.wound.drainage_odor,Has drainage or odor from the wound increased?,intake; monthly_checkin; care_plan_review,new,2,recommended,,true,false,false,Screens for worsening local wound burden.,Review a yes response during routine CCM follow-up.,"{""displayWhen"":[],""followUpTriggers"":[]}",,,,,,,,,pending,,,question:non_pressure_chronic_ulcer:base:ccm.wound.drainage_odor,question,ccm-bank.non_pressure_chronic_ulcer,1,1
39,Non-Pressure Chronic Ulcer,non_pressure_chronic_ulcer,,ccm.wound.dressing_access,Do you have the supplies and help needed for wound care?,intake; monthly_checkin; care_plan_review,new,2,recommended,routine,true,false,false,Identifies supply or caregiver barriers that can delay healing.,Review a yes response during routine CCM follow-up.,"{""displayWhen"":[],""followUpTriggers"":[{""id"":""ccm-wound-dressing_access-task"",""when"":{""operator"":""equals"",""value"":true},""actions"":[{""type"":""create_care_coordination_task"",""code"":""wound_care_supply_or_help"",""urgency"":""routine""}]}]}",,,,,,,,,pending,,,question:non_pressure_chronic_ulcer:base:ccm.wound.dressing_access,question,ccm-bank.non_pressure_chronic_ulcer,1,1
39,Non-Pressure Chronic Ulcer,non_pressure_chronic_ulcer,,ccm.wound.appointment_pending,"Is a wound, podiatry, vascular, or infectious-disease visit overdue?",intake; monthly_checkin; care_plan_review,new,2,recommended,,true,false,false,Identifies overdue specialty follow-up relevant to wound healing.,Review a yes response during routine CCM follow-up.,"{""displayWhen"":[],""followUpTriggers"":[]}",,,,,,,,,pending,,,question:non_pressure_chronic_ulcer:base:ccm.wound.appointment_pending,question,ccm-bank.non_pressure_chronic_ulcer,1,1
39,Non-Pressure Chronic Ulcer,non_pressure_chronic_ulcer,,ccm.pain.severity,What is your pain level today from 0 to 10?,intake; monthly_checkin; care_plan_review; annual_review,existing,20,recommended,same_day,true,false,false,Reuses an established CCM question whose wording and intent fit this condition bank.,Apply the established reusable-question branching and follow-up rules.,"{""displayWhen"":[],""followUpTriggers"":[{""id"":""high-pain"",""when"":{""operator"":""greater_than_or_equal"",""value"":8},""actions"":[{""type"":""flag_for_review"",""code"":""high_pain"",""urgency"":""same_day"",""providerNotification"":true}]}]}",,,,,,,,,pending,,,question:non_pressure_chronic_ulcer:base:ccm.pain.severity,question,ccm-bank.non_pressure_chronic_ulcer,1,1
39,Non-Pressure Chronic Ulcer,non_pressure_chronic_ulcer,,ccm.specialist.pending_followup,"Is any specialist recommendation, test, or follow-up still incomplete?",intake; monthly_checkin; care_plan_review; annual_review,existing,47,recommended,routine,true,false,false,Reuses an established CCM question whose wording and intent fit this condition bank.,Apply the established reusable-question branching and follow-up rules.,"{""displayWhen"":[],""followUpTriggers"":[{""id"":""ccm.specialist.pending_followup-task"",""when"":{""operator"":""equals"",""value"":true},""actions"":[{""type"":""create_care_coordination_task"",""code"":""ccm_specialist_pending_followup"",""urgency"":""routine""}]}]}",,,,,,,,,pending,,,question:non_pressure_chronic_ulcer:base:ccm.specialist.pending_followup,question,ccm-bank.non_pressure_chronic_ulcer,1,1
39,Non-Pressure Chronic Ulcer,non_pressure_chronic_ulcer,,ccm.coordination.open_need,"Do you need help arranging care, equipment, referrals, records, or services?",intake; monthly_checkin; care_plan_review; annual_review,existing,10,recommended,routine,true,false,false,Reuses an established CCM question whose wording and intent fit this condition bank.,Apply the established reusable-question branching and follow-up rules.,"{""displayWhen"":[],""followUpTriggers"":[{""id"":""ccm.coordination.open_need-task"",""when"":{""operator"":""equals"",""value"":true},""actions"":[{""type"":""create_care_coordination_task"",""code"":""ccm_coordination_open_need"",""urgency"":""routine""}]}]}",,,,,,,,,pending,,,question:non_pressure_chronic_ulcer:base:ccm.coordination.open_need,question,ccm-bank.non_pressure_chronic_ulcer,1,1
39,Non-Pressure Chronic Ulcer,non_pressure_chronic_ulcer,,ccm.goal.priority,What health or daily-life goal matters most to you now?,intake; care_plan_review; annual_review,existing,79,optional,,false,false,false,Reuses an established CCM question whose wording and intent fit this condition bank.,Apply the established reusable-question branching and follow-up rules.,"{""displayWhen"":[],""followUpTriggers"":[]}",,,,,,,,,pending,,,question:non_pressure_chronic_ulcer:base:ccm.goal.priority,question,ccm-bank.non_pressure_chronic_ulcer,1,1
39,Non-Pressure Chronic Ulcer,non_pressure_chronic_ulcer,deep_tissue,ccm.wound.infection_red_flag,"Do you have spreading redness, warmth, or fever with the wound?",intake; monthly_checkin; care_plan_review,new,2,recommended,same_day,true,false,true,Screens for possible spreading infection requiring prompt review.,A yes response creates a same_day clinical-review flag.,"{""displayWhen"":[],""followUpTriggers"":[{""id"":""ccm-wound-infection_red_flag-yes"",""when"":{""operator"":""equals"",""value"":true},""actions"":[{""type"":""flag_for_review"",""code"":""possible_wound_infection"",""urgency"":""same_day"",""providerNotification"":true}]}]}",,,,,,,,,pending,,,question:non_pressure_chronic_ulcer:deep_tissue:ccm.wound.infection_red_flag,question,ccm-bank.non_pressure_chronic_ulcer,1,1
40,Chronic Gout,chronic_gout,,ccm.general.health_change,Has your health changed since the last review?,intake; monthly_checkin; care_plan_review; annual_review,existing,81,required,soon,true,true,false,Reuses an established CCM question whose wording and intent fit this condition bank.,Apply the established reusable-question branching and follow-up rules.,"{""displayWhen"":[],""followUpTriggers"":[{""id"":""general-health-worse"",""when"":{""operator"":""equals"",""value"":""worse""},""actions"":[{""type"":""flag_for_review"",""code"":""health_worsening"",""urgency"":""soon"",""providerNotification"":false}]}]}",,,,,,,,,pending,,,question:chronic_gout:base:ccm.general.health_change,question,ccm-bank.chronic_gout,1,1
40,Chronic Gout,chronic_gout,,ccm.medication.has_issue,Are you having any problem taking or obtaining your medications?,intake; monthly_checkin; care_plan_review; annual_review,existing,78,recommended,,true,false,false,Reuses an established CCM question whose wording and intent fit this condition bank.,Apply the established reusable-question branching and follow-up rules.,"{""displayWhen"":[],""followUpTriggers"":[{""id"":""medication-issue-details"",""when"":{""operator"":""equals"",""value"":true},""actions"":[{""type"":""show_questions"",""questionIds"":[""ccm.medication.issue_reasons"",""ccm.medication.provider_aware""]}]}]}",,,,,,,,,pending,,,question:chronic_gout:base:ccm.medication.has_issue,question,ccm-bank.chronic_gout,1,1
40,Chronic Gout,chronic_gout,,ccm.function.daily_activity_difficulty,Are health problems making daily activities harder?,intake; monthly_checkin; care_plan_review; annual_review,existing,72,recommended,soon,true,false,false,Reuses an established CCM question whose wording and intent fit this condition bank.,Apply the established reusable-question branching and follow-up rules.,"{""displayWhen"":[],""followUpTriggers"":[{""id"":""function-review"",""when"":{""operator"":""equals"",""value"":true},""actions"":[{""type"":""flag_for_review"",""code"":""functional_decline"",""urgency"":""soon"",""providerNotification"":false}]}]}",,,,,,,,,pending,,,question:chronic_gout:base:ccm.function.daily_activity_difficulty,question,ccm-bank.chronic_gout,1,1
40,Chronic Gout,chronic_gout,,ccm.treatment.plan_barrier,Is anything making it difficult to follow the care plan for this condition?,intake; monthly_checkin; care_plan_review,new,52,recommended,routine,true,false,false,"Identifies adherence, access, understanding, and feasibility barriers without assuming a specific treatment.",A yes response creates a routine coordinator task to identify and address the barrier.,"{""displayWhen"":[],""followUpTriggers"":[{""id"":""ccm-treatment-plan_barrier-task"",""when"":{""operator"":""equals"",""value"":true},""actions"":[{""type"":""create_care_coordination_task"",""code"":""condition_care_plan_barrier"",""urgency"":""routine""}]}]}",,,,,,,,,pending,,,question:chronic_gout:base:ccm.treatment.plan_barrier,question,ccm-bank.chronic_gout,1,1
40,Chronic Gout,chronic_gout,,ccm.specialist.visit_change,Has a specialist changed this condition's treatment plan since the last contact?,intake; monthly_checkin; care_plan_review,new,37,recommended,routine,true,false,false,Captures treatment changes that may require medication reconciliation or care-plan updates.,A yes response creates a routine coordinator task to reconcile the updated specialist plan.,"{""displayWhen"":[],""followUpTriggers"":[{""id"":""ccm-specialist-visit_change-task"",""when"":{""operator"":""equals"",""value"":true},""actions"":[{""type"":""create_care_coordination_task"",""code"":""specialist_plan_reconciliation"",""urgency"":""routine""}]}]}",,,,,,,,,pending,,,question:chronic_gout:base:ccm.specialist.visit_change,question,ccm-bank.chronic_gout,1,1
40,Chronic Gout,chronic_gout,,ccm.inflammatory.flare_change,"Compared with the last review, how have condition flares changed?",intake; monthly_checkin; care_plan_review,new,5,recommended,,true,false,false,Tracks inflammatory disease activity without combining separate symptoms into one diagnostic assumption.,Review worsening or high-burden responses during routine CCM follow-up.,"{""displayWhen"":[],""followUpTriggers"":[]}",,,,,,,,,pending,,,question:chronic_gout:base:ccm.inflammatory.flare_change,question,ccm-bank.chronic_gout,1,1
40,Chronic Gout,chronic_gout,,ccm.inflammatory.swelling,Have you had new or worsening joint swelling?,intake; monthly_checkin; care_plan_review,new,3,recommended,,true,false,false,Identifies a change in inflammatory joint activity.,Review a yes response during routine CCM follow-up.,"{""displayWhen"":[],""followUpTriggers"":[]}",,,,,,,,,pending,,,question:chronic_gout:base:ccm.inflammatory.swelling,question,ccm-bank.chronic_gout,1,1
40,Chronic Gout,chronic_gout,,ccm.inflammatory.infection_signs,Have you had a fever or other infection concern while using immune-suppressing treatment?,intake; monthly_checkin; care_plan_review,new,5,recommended,same_day,true,false,true,Screens for infection concerns when immune-suppressing treatment is actually in use.,A yes response creates a same_day clinical-review flag.,"{""displayWhen"":[],""followUpTriggers"":[{""id"":""ccm-inflammatory-infection_signs-yes"",""when"":{""operator"":""equals"",""value"":true},""actions"":[{""type"":""flag_for_review"",""code"":""infection_concern_on_immunosuppression"",""urgency"":""same_day"",""providerNotification"":true}]}]}",,,,,,,,,pending,,,question:chronic_gout:base:ccm.inflammatory.infection_signs,question,ccm-bank.chronic_gout,1,1
40,Chronic Gout,chronic_gout,,ccm.gout.flare_frequency,How many gout flares have you had since the last review?,intake; monthly_checkin; care_plan_review,new,1,recommended,,true,false,false,Measures recent gout activity using a deterministic frequency range.,Review worsening or high-burden responses during routine CCM follow-up.,"{""displayWhen"":[],""followUpTriggers"":[]}",,,,,,,,,pending,,,question:chronic_gout:base:ccm.gout.flare_frequency,question,ccm-bank.chronic_gout,1,1
40,Chronic Gout,chronic_gout,,ccm.pain.severity,What is your pain level today from 0 to 10?,intake; monthly_checkin; care_plan_review; annual_review,existing,20,recommended,same_day,true,false,false,Reuses an established CCM question whose wording and intent fit this condition bank.,Apply the established reusable-question branching and follow-up rules.,"{""displayWhen"":[],""followUpTriggers"":[{""id"":""high-pain"",""when"":{""operator"":""greater_than_or_equal"",""value"":8},""actions"":[{""type"":""flag_for_review"",""code"":""high_pain"",""urgency"":""same_day"",""providerNotification"":true}]}]}",,,,,,,,,pending,,,question:chronic_gout:base:ccm.pain.severity,question,ccm-bank.chronic_gout,1,1
40,Chronic Gout,chronic_gout,,ccm.pain.function_interference,Is pain preventing an important daily activity?,intake; monthly_checkin; care_plan_review; annual_review,existing,13,recommended,soon,true,false,false,Reuses an established CCM question whose wording and intent fit this condition bank.,Apply the established reusable-question branching and follow-up rules.,"{""displayWhen"":[],""followUpTriggers"":[{""id"":""pain-function-review"",""when"":{""operator"":""equals"",""value"":true},""actions"":[{""type"":""flag_for_review"",""code"":""pain_function_limit"",""urgency"":""soon"",""providerNotification"":false}]}]}",,,,,,,,,pending,,,question:chronic_gout:base:ccm.pain.function_interference,question,ccm-bank.chronic_gout,1,1
40,Chronic Gout,chronic_gout,,ccm.falls.had_fall,Have you fallen since the last review?,intake; monthly_checkin; care_plan_review; annual_review,existing,32,recommended,,true,false,false,Reuses an established CCM question whose wording and intent fit this condition bank.,Apply the established reusable-question branching and follow-up rules.,"{""displayWhen"":[],""followUpTriggers"":[{""id"":""fall-flow"",""when"":{""operator"":""equals"",""value"":true},""actions"":[{""type"":""show_questions"",""questionIds"":[""ccm.falls.date"",""ccm.falls.injury"",""ccm.falls.er_visit"",""ccm.falls.recurring""]}]}]}",,,,,,,,,pending,,,question:chronic_gout:base:ccm.falls.had_fall,question,ccm-bank.chronic_gout,1,1
40,Chronic Gout,chronic_gout,,ccm.goal.priority,What health or daily-life goal matters most to you now?,intake; care_plan_review; annual_review,existing,79,optional,,false,false,false,Reuses an established CCM question whose wording and intent fit this condition bank.,Apply the established reusable-question branching and follow-up rules.,"{""displayWhen"":[],""followUpTriggers"":[]}",,,,,,,,,pending,,,question:chronic_gout:base:ccm.goal.priority,question,ccm-bank.chronic_gout,1,1
40,Chronic Gout,chronic_gout,tophaceous,ccm.gout.tophus_change,"Have any gout lumps or tophi become larger, painful, or opened?",intake; monthly_checkin; care_plan_review,new,1,recommended,,true,false,false,Monitors clinically relevant tophus change and skin breakdown.,Review a yes response during routine CCM follow-up.,"{""displayWhen"":[],""followUpTriggers"":[]}",,,,,,,,,pending,,,question:chronic_gout:tophaceous:ccm.gout.tophus_change,question,ccm-bank.chronic_gout,1,1
41,Bronchiectasis,bronchiectasis,,ccm.general.health_change,Has your health changed since the last review?,intake; monthly_checkin; care_plan_review; annual_review,existing,81,required,soon,true,true,false,Reuses an established CCM question whose wording and intent fit this condition bank.,Apply the established reusable-question branching and follow-up rules.,"{""displayWhen"":[],""followUpTriggers"":[{""id"":""general-health-worse"",""when"":{""operator"":""equals"",""value"":""worse""},""actions"":[{""type"":""flag_for_review"",""code"":""health_worsening"",""urgency"":""soon"",""providerNotification"":false}]}]}",,,,,,,,,pending,,,question:bronchiectasis:base:ccm.general.health_change,question,ccm-bank.bronchiectasis,1,1
41,Bronchiectasis,bronchiectasis,,ccm.medication.has_issue,Are you having any problem taking or obtaining your medications?,intake; monthly_checkin; care_plan_review; annual_review,existing,78,recommended,,true,false,false,Reuses an established CCM question whose wording and intent fit this condition bank.,Apply the established reusable-question branching and follow-up rules.,"{""displayWhen"":[],""followUpTriggers"":[{""id"":""medication-issue-details"",""when"":{""operator"":""equals"",""value"":true},""actions"":[{""type"":""show_questions"",""questionIds"":[""ccm.medication.issue_reasons"",""ccm.medication.provider_aware""]}]}]}",,,,,,,,,pending,,,question:bronchiectasis:base:ccm.medication.has_issue,question,ccm-bank.bronchiectasis,1,1
41,Bronchiectasis,bronchiectasis,,ccm.function.daily_activity_difficulty,Are health problems making daily activities harder?,intake; monthly_checkin; care_plan_review; annual_review,existing,72,recommended,soon,true,false,false,Reuses an established CCM question whose wording and intent fit this condition bank.,Apply the established reusable-question branching and follow-up rules.,"{""displayWhen"":[],""followUpTriggers"":[{""id"":""function-review"",""when"":{""operator"":""equals"",""value"":true},""actions"":[{""type"":""flag_for_review"",""code"":""functional_decline"",""urgency"":""soon"",""providerNotification"":false}]}]}",,,,,,,,,pending,,,question:bronchiectasis:base:ccm.function.daily_activity_difficulty,question,ccm-bank.bronchiectasis,1,1
