priority_rank,canonical_condition,canonical_condition_id,variant_id,question_id,question_text,contexts,source,reuse_bank_count,current_selection_level,current_urgency,default_selected,required,red_flag,clinical_rationale,follow_up_behavior,current_branching,feedback_action,proposed_text,proposed_selection_level,proposed_urgency,proposed_branching,reviewer,reviewed_at,rationale,disposition,accepted_by,accepted_at,feedback_id,row_type,bank_id,current_bank_version,current_question_version
56,Nicotine Dependence,nicotine_dependence,,ccm.general.health_change,Has your health changed since the last review?,intake; monthly_checkin; care_plan_review; annual_review,existing,81,required,soon,true,true,false,Reuses an established CCM question whose wording and intent fit this condition bank.,Apply the established reusable-question branching and follow-up rules.,"{""displayWhen"":[],""followUpTriggers"":[{""id"":""general-health-worse"",""when"":{""operator"":""equals"",""value"":""worse""},""actions"":[{""type"":""flag_for_review"",""code"":""health_worsening"",""urgency"":""soon"",""providerNotification"":false}]}]}",,,,,,,,,pending,,,question:nicotine_dependence:base:ccm.general.health_change,question,ccm-bank.nicotine_dependence,1,1
56,Nicotine Dependence,nicotine_dependence,,ccm.medication.has_issue,Are you having any problem taking or obtaining your medications?,intake; monthly_checkin; care_plan_review; annual_review,existing,78,recommended,,true,false,false,Reuses an established CCM question whose wording and intent fit this condition bank.,Apply the established reusable-question branching and follow-up rules.,"{""displayWhen"":[],""followUpTriggers"":[{""id"":""medication-issue-details"",""when"":{""operator"":""equals"",""value"":true},""actions"":[{""type"":""show_questions"",""questionIds"":[""ccm.medication.issue_reasons"",""ccm.medication.provider_aware""]}]}]}",,,,,,,,,pending,,,question:nicotine_dependence:base:ccm.medication.has_issue,question,ccm-bank.nicotine_dependence,1,1
56,Nicotine Dependence,nicotine_dependence,,ccm.function.daily_activity_difficulty,Are health problems making daily activities harder?,intake; monthly_checkin; care_plan_review; annual_review,existing,72,recommended,soon,true,false,false,Reuses an established CCM question whose wording and intent fit this condition bank.,Apply the established reusable-question branching and follow-up rules.,"{""displayWhen"":[],""followUpTriggers"":[{""id"":""function-review"",""when"":{""operator"":""equals"",""value"":true},""actions"":[{""type"":""flag_for_review"",""code"":""functional_decline"",""urgency"":""soon"",""providerNotification"":false}]}]}",,,,,,,,,pending,,,question:nicotine_dependence:base:ccm.function.daily_activity_difficulty,question,ccm-bank.nicotine_dependence,1,1
56,Nicotine Dependence,nicotine_dependence,,ccm.treatment.plan_barrier,Is anything making it difficult to follow the care plan for this condition?,intake; monthly_checkin; care_plan_review,new,52,recommended,routine,true,false,false,"Identifies adherence, access, understanding, and feasibility barriers without assuming a specific treatment.",A yes response creates a routine coordinator task to identify and address the barrier.,"{""displayWhen"":[],""followUpTriggers"":[{""id"":""ccm-treatment-plan_barrier-task"",""when"":{""operator"":""equals"",""value"":true},""actions"":[{""type"":""create_care_coordination_task"",""code"":""condition_care_plan_barrier"",""urgency"":""routine""}]}]}",,,,,,,,,pending,,,question:nicotine_dependence:base:ccm.treatment.plan_barrier,question,ccm-bank.nicotine_dependence,1,1
56,Nicotine Dependence,nicotine_dependence,,ccm.specialist.visit_change,Has a specialist changed this condition's treatment plan since the last contact?,intake; monthly_checkin; care_plan_review,new,37,recommended,routine,true,false,false,Captures treatment changes that may require medication reconciliation or care-plan updates.,A yes response creates a routine coordinator task to reconcile the updated specialist plan.,"{""displayWhen"":[],""followUpTriggers"":[{""id"":""ccm-specialist-visit_change-task"",""when"":{""operator"":""equals"",""value"":true},""actions"":[{""type"":""create_care_coordination_task"",""code"":""specialist_plan_reconciliation"",""urgency"":""routine""}]}]}",,,,,,,,,pending,,,question:nicotine_dependence:base:ccm.specialist.visit_change,question,ccm-bank.nicotine_dependence,1,1
56,Nicotine Dependence,nicotine_dependence,,ccm.substance.use_since_contact,Have you used the substance related to this diagnosis since the last contact?,intake; monthly_checkin; care_plan_review,new,3,recommended,,true,false,false,Tracks current use without judgment and supports treatment planning.,Review a yes response during routine CCM follow-up.,"{""displayWhen"":[],""followUpTriggers"":[]}",,,,,,,,,pending,,,question:nicotine_dependence:base:ccm.substance.use_since_contact,question,ccm-bank.nicotine_dependence,1,1
56,Nicotine Dependence,nicotine_dependence,,ccm.substance.craving_change,"Compared with the last review, how have cravings changed?",intake; monthly_checkin; care_plan_review,new,3,recommended,,true,false,false,Tracks relapse risk using a deterministic response set.,Review worsening or high-burden responses during routine CCM follow-up.,"{""displayWhen"":[],""followUpTriggers"":[]}",,,,,,,,,pending,,,question:nicotine_dependence:base:ccm.substance.craving_change,question,ccm-bank.nicotine_dependence,1,1
56,Nicotine Dependence,nicotine_dependence,,ccm.substance.treatment_access,"Have you had trouble getting counseling, recovery support, or prescribed treatment?",intake; monthly_checkin; care_plan_review,new,3,recommended,,true,false,false,Identifies access barriers to ongoing substance-use treatment.,Review a yes response during routine CCM follow-up.,"{""displayWhen"":[],""followUpTriggers"":[]}",,,,,,,,,pending,,,question:nicotine_dependence:base:ccm.substance.treatment_access,question,ccm-bank.nicotine_dependence,1,1
56,Nicotine Dependence,nicotine_dependence,,ccm.tobacco.quit_support,Would support for reducing or stopping nicotine use be helpful now?,intake; monthly_checkin; care_plan_review,new,1,recommended,,true,false,false,Identifies readiness for support without assuming a quit attempt.,Review a yes response during routine CCM follow-up.,"{""displayWhen"":[],""followUpTriggers"":[]}",,,,,,,,,pending,,,question:nicotine_dependence:base:ccm.tobacco.quit_support,question,ccm-bank.nicotine_dependence,1,1
56,Nicotine Dependence,nicotine_dependence,,ccm.mental.mood_frequency,"How often have you felt down, depressed, or hopeless in the past two weeks?",intake; monthly_checkin; care_plan_review; annual_review,existing,8,recommended,soon,true,false,false,Reuses an established CCM question whose wording and intent fit this condition bank.,Apply the established reusable-question branching and follow-up rules.,"{""displayWhen"":[],""followUpTriggers"":[{""id"":""mood-frequent"",""when"":{""operator"":""in"",""value"":[""more_than_half"",""nearly_every_day""]},""actions"":[{""type"":""flag_for_review"",""code"":""frequent_depressive_symptoms"",""urgency"":""soon"",""providerNotification"":true}]}]}",,,,,,,,,pending,,,question:nicotine_dependence:base:ccm.mental.mood_frequency,question,ccm-bank.nicotine_dependence,1,1
56,Nicotine Dependence,nicotine_dependence,,ccm.mental.anxiety_frequency,"How often have you felt nervous, anxious, or unable to control worry in the past two weeks?",intake; monthly_checkin; care_plan_review; annual_review,existing,8,recommended,soon,true,false,false,Reuses an established CCM question whose wording and intent fit this condition bank.,Apply the established reusable-question branching and follow-up rules.,"{""displayWhen"":[],""followUpTriggers"":[{""id"":""anxiety-frequent"",""when"":{""operator"":""in"",""value"":[""more_than_half"",""nearly_every_day""]},""actions"":[{""type"":""flag_for_review"",""code"":""frequent_anxiety_symptoms"",""urgency"":""soon"",""providerNotification"":true}]}]}",,,,,,,,,pending,,,question:nicotine_dependence:base:ccm.mental.anxiety_frequency,question,ccm-bank.nicotine_dependence,1,1
56,Nicotine Dependence,nicotine_dependence,,ccm.sleep.quality,How would you rate your sleep quality?,intake; monthly_checkin; care_plan_review; annual_review,existing,24,recommended,,true,false,false,Reuses an established CCM question whose wording and intent fit this condition bank.,Apply the established reusable-question branching and follow-up rules.,"{""displayWhen"":[],""followUpTriggers"":[]}",,,,,,,,,pending,,,question:nicotine_dependence:base:ccm.sleep.quality,question,ccm-bank.nicotine_dependence,1,1
56,Nicotine Dependence,nicotine_dependence,,ccm.goal.priority,What health or daily-life goal matters most to you now?,intake; care_plan_review; annual_review,existing,79,optional,,false,false,false,Reuses an established CCM question whose wording and intent fit this condition bank.,Apply the established reusable-question branching and follow-up rules.,"{""displayWhen"":[],""followUpTriggers"":[]}",,,,,,,,,pending,,,question:nicotine_dependence:base:ccm.goal.priority,question,ccm-bank.nicotine_dependence,1,1
57,Epilepsy,epilepsy,,ccm.general.health_change,Has your health changed since the last review?,intake; monthly_checkin; care_plan_review; annual_review,existing,81,required,soon,true,true,false,Reuses an established CCM question whose wording and intent fit this condition bank.,Apply the established reusable-question branching and follow-up rules.,"{""displayWhen"":[],""followUpTriggers"":[{""id"":""general-health-worse"",""when"":{""operator"":""equals"",""value"":""worse""},""actions"":[{""type"":""flag_for_review"",""code"":""health_worsening"",""urgency"":""soon"",""providerNotification"":false}]}]}",,,,,,,,,pending,,,question:epilepsy:base:ccm.general.health_change,question,ccm-bank.epilepsy,1,1
57,Epilepsy,epilepsy,,ccm.medication.has_issue,Are you having any problem taking or obtaining your medications?,intake; monthly_checkin; care_plan_review; annual_review,existing,78,recommended,,true,false,false,Reuses an established CCM question whose wording and intent fit this condition bank.,Apply the established reusable-question branching and follow-up rules.,"{""displayWhen"":[],""followUpTriggers"":[{""id"":""medication-issue-details"",""when"":{""operator"":""equals"",""value"":true},""actions"":[{""type"":""show_questions"",""questionIds"":[""ccm.medication.issue_reasons"",""ccm.medication.provider_aware""]}]}]}",,,,,,,,,pending,,,question:epilepsy:base:ccm.medication.has_issue,question,ccm-bank.epilepsy,1,1
57,Epilepsy,epilepsy,,ccm.function.daily_activity_difficulty,Are health problems making daily activities harder?,intake; monthly_checkin; care_plan_review; annual_review,existing,72,recommended,soon,true,false,false,Reuses an established CCM question whose wording and intent fit this condition bank.,Apply the established reusable-question branching and follow-up rules.,"{""displayWhen"":[],""followUpTriggers"":[{""id"":""function-review"",""when"":{""operator"":""equals"",""value"":true},""actions"":[{""type"":""flag_for_review"",""code"":""functional_decline"",""urgency"":""soon"",""providerNotification"":false}]}]}",,,,,,,,,pending,,,question:epilepsy:base:ccm.function.daily_activity_difficulty,question,ccm-bank.epilepsy,1,1
57,Epilepsy,epilepsy,,ccm.seizure.event,Have you had a seizure since the last review?,intake; monthly_checkin; care_plan_review,new,1,recommended,same_day,true,false,true,Tracks the core disease event for epilepsy.,A yes response creates a same_day clinical-review flag.,"{""displayWhen"":[],""followUpTriggers"":[{""id"":""ccm-seizure-event-yes"",""when"":{""operator"":""equals"",""value"":true},""actions"":[{""type"":""flag_for_review"",""code"":""breakthrough_seizure"",""urgency"":""same_day"",""providerNotification"":true}]}]}",,,,,,,,,pending,,,question:epilepsy:base:ccm.seizure.event,question,ccm-bank.epilepsy,1,1
57,Epilepsy,epilepsy,,ccm.seizure.rescue_plan,Do you or your caregiver need help understanding or obtaining the seizure rescue plan?,intake; monthly_checkin; care_plan_review,new,1,recommended,,true,false,false,Identifies education or access gaps for an established rescue plan.,Review a yes response during routine CCM follow-up.,"{""displayWhen"":[],""followUpTriggers"":[]}",,,,,,,,,pending,,,question:epilepsy:base:ccm.seizure.rescue_plan,question,ccm-bank.epilepsy,1,1
57,Epilepsy,epilepsy,,ccm.falls.had_fall,Have you fallen since the last review?,intake; monthly_checkin; care_plan_review; annual_review,existing,32,recommended,,true,false,false,Reuses an established CCM question whose wording and intent fit this condition bank.,Apply the established reusable-question branching and follow-up rules.,"{""displayWhen"":[],""followUpTriggers"":[{""id"":""fall-flow"",""when"":{""operator"":""equals"",""value"":true},""actions"":[{""type"":""show_questions"",""questionIds"":[""ccm.falls.date"",""ccm.falls.injury"",""ccm.falls.er_visit"",""ccm.falls.recurring""]}]}]}",,,,,,,,,pending,,,question:epilepsy:base:ccm.falls.had_fall,question,ccm-bank.epilepsy,1,1
57,Epilepsy,epilepsy,,ccm.specialist.pending_followup,"Is any specialist recommendation, test, or follow-up still incomplete?",intake; monthly_checkin; care_plan_review; annual_review,existing,47,recommended,routine,true,false,false,Reuses an established CCM question whose wording and intent fit this condition bank.,Apply the established reusable-question branching and follow-up rules.,"{""displayWhen"":[],""followUpTriggers"":[{""id"":""ccm.specialist.pending_followup-task"",""when"":{""operator"":""equals"",""value"":true},""actions"":[{""type"":""create_care_coordination_task"",""code"":""ccm_specialist_pending_followup"",""urgency"":""routine""}]}]}",,,,,,,,,pending,,,question:epilepsy:base:ccm.specialist.pending_followup,question,ccm-bank.epilepsy,1,1
57,Epilepsy,epilepsy,,ccm.sleep.quality,How would you rate your sleep quality?,intake; monthly_checkin; care_plan_review; annual_review,existing,24,recommended,,true,false,false,Reuses an established CCM question whose wording and intent fit this condition bank.,Apply the established reusable-question branching and follow-up rules.,"{""displayWhen"":[],""followUpTriggers"":[]}",,,,,,,,,pending,,,question:epilepsy:base:ccm.sleep.quality,question,ccm-bank.epilepsy,1,1
57,Epilepsy,epilepsy,,ccm.goal.priority,What health or daily-life goal matters most to you now?,intake; care_plan_review; annual_review,existing,79,optional,,false,false,false,Reuses an established CCM question whose wording and intent fit this condition bank.,Apply the established reusable-question branching and follow-up rules.,"{""displayWhen"":[],""followUpTriggers"":[]}",,,,,,,,,pending,,,question:epilepsy:base:ccm.goal.priority,question,ccm-bank.epilepsy,1,1
58,Psoriasis,psoriasis,,ccm.general.health_change,Has your health changed since the last review?,intake; monthly_checkin; care_plan_review; annual_review,existing,81,required,soon,true,true,false,Reuses an established CCM question whose wording and intent fit this condition bank.,Apply the established reusable-question branching and follow-up rules.,"{""displayWhen"":[],""followUpTriggers"":[{""id"":""general-health-worse"",""when"":{""operator"":""equals"",""value"":""worse""},""actions"":[{""type"":""flag_for_review"",""code"":""health_worsening"",""urgency"":""soon"",""providerNotification"":false}]}]}",,,,,,,,,pending,,,question:psoriasis:base:ccm.general.health_change,question,ccm-bank.psoriasis,1,1
58,Psoriasis,psoriasis,,ccm.medication.has_issue,Are you having any problem taking or obtaining your medications?,intake; monthly_checkin; care_plan_review; annual_review,existing,78,recommended,,true,false,false,Reuses an established CCM question whose wording and intent fit this condition bank.,Apply the established reusable-question branching and follow-up rules.,"{""displayWhen"":[],""followUpTriggers"":[{""id"":""medication-issue-details"",""when"":{""operator"":""equals"",""value"":true},""actions"":[{""type"":""show_questions"",""questionIds"":[""ccm.medication.issue_reasons"",""ccm.medication.provider_aware""]}]}]}",,,,,,,,,pending,,,question:psoriasis:base:ccm.medication.has_issue,question,ccm-bank.psoriasis,1,1
58,Psoriasis,psoriasis,,ccm.function.daily_activity_difficulty,Are health problems making daily activities harder?,intake; monthly_checkin; care_plan_review; annual_review,existing,72,recommended,soon,true,false,false,Reuses an established CCM question whose wording and intent fit this condition bank.,Apply the established reusable-question branching and follow-up rules.,"{""displayWhen"":[],""followUpTriggers"":[{""id"":""function-review"",""when"":{""operator"":""equals"",""value"":true},""actions"":[{""type"":""flag_for_review"",""code"":""functional_decline"",""urgency"":""soon"",""providerNotification"":false}]}]}",,,,,,,,,pending,,,question:psoriasis:base:ccm.function.daily_activity_difficulty,question,ccm-bank.psoriasis,1,1
58,Psoriasis,psoriasis,,ccm.treatment.plan_barrier,Is anything making it difficult to follow the care plan for this condition?,intake; monthly_checkin; care_plan_review,new,52,recommended,routine,true,false,false,"Identifies adherence, access, understanding, and feasibility barriers without assuming a specific treatment.",A yes response creates a routine coordinator task to identify and address the barrier.,"{""displayWhen"":[],""followUpTriggers"":[{""id"":""ccm-treatment-plan_barrier-task"",""when"":{""operator"":""equals"",""value"":true},""actions"":[{""type"":""create_care_coordination_task"",""code"":""condition_care_plan_barrier"",""urgency"":""routine""}]}]}",,,,,,,,,pending,,,question:psoriasis:base:ccm.treatment.plan_barrier,question,ccm-bank.psoriasis,1,1
58,Psoriasis,psoriasis,,ccm.specialist.visit_change,Has a specialist changed this condition's treatment plan since the last contact?,intake; monthly_checkin; care_plan_review,new,37,recommended,routine,true,false,false,Captures treatment changes that may require medication reconciliation or care-plan updates.,A yes response creates a routine coordinator task to reconcile the updated specialist plan.,"{""displayWhen"":[],""followUpTriggers"":[{""id"":""ccm-specialist-visit_change-task"",""when"":{""operator"":""equals"",""value"":true},""actions"":[{""type"":""create_care_coordination_task"",""code"":""specialist_plan_reconciliation"",""urgency"":""routine""}]}]}",,,,,,,,,pending,,,question:psoriasis:base:ccm.specialist.visit_change,question,ccm-bank.psoriasis,1,1
58,Psoriasis,psoriasis,,ccm.inflammatory.flare_change,"Compared with the last review, how have condition flares changed?",intake; monthly_checkin; care_plan_review,new,5,recommended,,true,false,false,Tracks inflammatory disease activity without combining separate symptoms into one diagnostic assumption.,Review worsening or high-burden responses during routine CCM follow-up.,"{""displayWhen"":[],""followUpTriggers"":[]}",,,,,,,,,pending,,,question:psoriasis:base:ccm.inflammatory.flare_change,question,ccm-bank.psoriasis,1,1
58,Psoriasis,psoriasis,,ccm.inflammatory.infection_signs,Have you had a fever or other infection concern while using immune-suppressing treatment?,intake; monthly_checkin; care_plan_review,new,5,recommended,same_day,true,false,true,Screens for infection concerns when immune-suppressing treatment is actually in use.,A yes response creates a same_day clinical-review flag.,"{""displayWhen"":[],""followUpTriggers"":[{""id"":""ccm-inflammatory-infection_signs-yes"",""when"":{""operator"":""equals"",""value"":true},""actions"":[{""type"":""flag_for_review"",""code"":""infection_concern_on_immunosuppression"",""urgency"":""same_day"",""providerNotification"":true}]}]}",,,,,,,,,pending,,,question:psoriasis:base:ccm.inflammatory.infection_signs,question,ccm-bank.psoriasis,1,1
58,Psoriasis,psoriasis,,ccm.psoriasis.skin_change,Have your psoriasis patches become more widespread or uncomfortable?,intake; monthly_checkin; care_plan_review,new,1,recommended,,true,false,false,Tracks skin disease burden in patient-appropriate language.,Review a yes response during routine CCM follow-up.,"{""displayWhen"":[],""followUpTriggers"":[]}",,,,,,,,,pending,,,question:psoriasis:base:ccm.psoriasis.skin_change,question,ccm-bank.psoriasis,1,1
58,Psoriasis,psoriasis,,ccm.goal.priority,What health or daily-life goal matters most to you now?,intake; care_plan_review; annual_review,existing,79,optional,,false,false,false,Reuses an established CCM question whose wording and intent fit this condition bank.,Apply the established reusable-question branching and follow-up rules.,"{""displayWhen"":[],""followUpTriggers"":[]}",,,,,,,,,pending,,,question:psoriasis:base:ccm.goal.priority,question,ccm-bank.psoriasis,1,1
59,Type 1 Diabetes,type_1_diabetes,,ccm.general.health_change,Has your health changed since the last review?,intake; monthly_checkin; care_plan_review; annual_review,existing,81,required,soon,true,true,false,Reuses an established CCM question whose wording and intent fit this condition bank.,Apply the established reusable-question branching and follow-up rules.,"{""displayWhen"":[],""followUpTriggers"":[{""id"":""general-health-worse"",""when"":{""operator"":""equals"",""value"":""worse""},""actions"":[{""type"":""flag_for_review"",""code"":""health_worsening"",""urgency"":""soon"",""providerNotification"":false}]}]}",,,,,,,,,pending,,,question:type_1_diabetes:base:ccm.general.health_change,question,ccm-bank.type_1_diabetes,1,1
59,Type 1 Diabetes,type_1_diabetes,,ccm.diabetes.latest_glucose,What was your most recent blood glucose reading?,intake; monthly_checkin; care_plan_review; annual_review,existing,3,recommended,same_day,true,false,false,Reuses an established CCM question whose wording and intent fit this condition bank.,Apply the established reusable-question branching and follow-up rules.,"{""displayWhen"":[],""followUpTriggers"":[{""id"":""glucose-low"",""when"":{""operator"":""less_than"",""value"":70},""actions"":[{""type"":""flag_for_review"",""code"":""low_glucose"",""urgency"":""same_day"",""providerNotification"":true}]},{""id"":""glucose-high"",""when"":{""operator"":""greater_than"",""value"":300},""actions"":[{""type"":""flag_for_review"",""code"":""high_glucose"",""urgency"":""same_day"",""providerNotification"":true}]}]}",,,,,,,,,pending,,,question:type_1_diabetes:base:ccm.diabetes.latest_glucose,question,ccm-bank.type_1_diabetes,1,1
59,Type 1 Diabetes,type_1_diabetes,,ccm.diabetes.low_episode,Have you had symptoms of low blood sugar since the last review?,intake; monthly_checkin; care_plan_review; annual_review,existing,3,recommended,same_day,true,false,false,Reuses an established CCM question whose wording and intent fit this condition bank.,Apply the established reusable-question branching and follow-up rules.,"{""displayWhen"":[],""followUpTriggers"":[{""id"":""low-glucose-review"",""when"":{""operator"":""equals"",""value"":true},""actions"":[{""type"":""flag_for_review"",""code"":""possible_hypoglycemia"",""urgency"":""same_day"",""providerNotification"":true}]}]}",,,,,,,,,pending,,,question:type_1_diabetes:base:ccm.diabetes.low_episode,question,ccm-bank.type_1_diabetes,1,1
59,Type 1 Diabetes,type_1_diabetes,,ccm.diabetes.foot_concern,"Do you have a new sore, blister, redness, or numbness in either foot?",intake; monthly_checkin; care_plan_review; annual_review,existing,3,recommended,same_day,true,false,false,Reuses an established CCM question whose wording and intent fit this condition bank.,Apply the established reusable-question branching and follow-up rules.,"{""displayWhen"":[],""followUpTriggers"":[{""id"":""foot-concern-review"",""when"":{""operator"":""equals"",""value"":true},""actions"":[{""type"":""flag_for_review"",""code"":""diabetic_foot_concern"",""urgency"":""same_day"",""providerNotification"":true}]}]}",,,,,,,,,pending,,,question:type_1_diabetes:base:ccm.diabetes.foot_concern,question,ccm-bank.type_1_diabetes,1,1
59,Type 1 Diabetes,type_1_diabetes,,ccm.medication.has_issue,Are you having any problem taking or obtaining your medications?,intake; monthly_checkin; care_plan_review; annual_review,existing,78,recommended,,true,false,false,Reuses an established CCM question whose wording and intent fit this condition bank.,Apply the established reusable-question branching and follow-up rules.,"{""displayWhen"":[],""followUpTriggers"":[{""id"":""medication-issue-details"",""when"":{""operator"":""equals"",""value"":true},""actions"":[{""type"":""show_questions"",""questionIds"":[""ccm.medication.issue_reasons"",""ccm.medication.provider_aware""]}]}]}",,,,,,,,,pending,,,question:type_1_diabetes:base:ccm.medication.has_issue,question,ccm-bank.type_1_diabetes,1,1
59,Type 1 Diabetes,type_1_diabetes,kidney_complication,ccm.bp.latest_systolic,What was your most recent systolic blood pressure reading?,intake; monthly_checkin; care_plan_review; annual_review,existing,11,recommended,urgent,true,false,false,Reuses an established CCM question whose wording and intent fit this condition bank.,Apply the established reusable-question branching and follow-up rules.,"{""displayWhen"":[],""followUpTriggers"":[{""id"":""bp-very-high"",""when"":{""operator"":""greater_than_or_equal"",""value"":180},""actions"":[{""type"":""flag_for_review"",""code"":""very_high_systolic"",""urgency"":""urgent"",""providerNotification"":true}]},{""id"":""bp-low"",""when"":{""operator"":""less_than"",""value"":90},""actions"":[{""type"":""flag_for_review"",""code"":""low_systolic"",""urgency"":""same_day"",""providerNotification"":true}]}]}",,,,,,,,,pending,,,question:type_1_diabetes:kidney_complication:ccm.bp.latest_systolic,question,ccm-bank.type_1_diabetes,1,1
